Protein-name,gene-symbol,gene-name,ensembl-code,gene-description,spliceosomal-class,validated-class,splicing-references,ncbi-link,uniprot-link,genecards-link,string-db-link,gtex-ens-version
MBNL1,MBNL1,muscleblind like splicing regulator 1,ENSG00000152601,"It acts as an activator or repressor of splicing on specific pre-mRNA targets. It inhibits exon inclusion of cardiac troponin-T pre-mRNA (TNNT2), but induces exon inclusion of insulin receptor (IR) pre-mRNA in muscle. Regulates TNNT2 exon 5 ignoring competition with U2AF2. It inhibits spliceosome A complex formation in intron 4 of TNNT2 pre-mRNA. It attaches to the stem-loop structure within the polypyrimidine tract of TNNT2 intron 4 during spliceosome assembly. Binds to the consensus sequence 5'-YGCU (U/G) Y-3'.",A and B complex ,yes,"Warf MB, Diegel J V., Von Hippel PH, Berglund JA. The protein factors MBNL1 and U2AF65 bind alternative RNA structures to regulate splicing. Proc Natl Acad Sci U S A. 2009 Jun 9;106(23):9203–8. 
Liu H, Lorenzini PA, Zhang F, Xu S, Wong MSM, Zheng J, et al. Alternative splicing analysis in human monocytes and macrophages reveals MBNL1 as major regulator. Nucleic Acids Res. 2018 Jul 6;46(12):6069–86. 
Itskovich SS, Gurunathan A, Clark J, Burwinkel M, Wunderlich M, Berger MR, et al. MBNL1 regulates essential alternative RNA splicing patterns in MLL-rearranged leukemia. Nat Commun. 2020 Dec 1;11(1):1–14.
",https://www.ncbi.nlm.nih.gov/gene?Db=gene&Cmd=DetailsSearch&Term=4154,https://www.uniprot.org/uniprot/Q9NR56,https://www.genecards.org/cgi-bin/carddisp.pl?gene=MBNL1,https://string-db.org/network/9606.ENSP00000282486,17
CCDC49,CWC25,CWC25 spliceosome associated protein homolog,ENSG00000273559,Involved in splicing as a component of the spliceosome and encodes a factor that is part of the multiprotein C complex involved in pre-mRNA splicing.,C Complex,yes,"Zhan X, Yan C, Zhang X, Lei J, Shi Y. Structure of a human catalytic step I spliceosome. Science (80- ). 2018 Feb 2;359(6375):537–45. ",https://www.ncbi.nlm.nih.gov/gene?Db=gene&Cmd=DetailsSearch&Term=54883,https://www.uniprot.org/uniprot/Q9NXE8,https://www.genecards.org/cgi-bin/carddisp.pl?gene=CWC25,,4
PUF60,PUF60,poly(U) binding splicing factor 60,ENSG00000179950,DNA and RNA binding protein involved in pre-mRNA splicing. Promotes the splicing of an intron with a weak 3' splice site and pyrimidine tract cooperatively with U2AF2. Binds to poly(U) RNA.,U2 snRNP ,yes,"Hastings ML, Allemand E, Duelli DM, Myers MP, Krainer AR. Control of Pre-mRNA Splicing by the General Splicing Factors PUF60 and U2AF 65. PLoS One. 2007;2(6):538. 
Královičová J, Ševčíková I, Stejskalová E, Obuča M, Hiller M, Staněk D, et al. PUF60-activated exons uncover altered 3′ splice-site selection by germline missense mutations in a single RRM. Nucleic Acids Res. 2018 Jul 6;46(12):6166–87. 
Page-McCaw PS, Amonlirdviman K, Sharp PA. PUF60: A novel U2AF65-related splicing activity. RNA. 1999 Dec;5(12):1548–60. 
",https://www.ncbi.nlm.nih.gov/gene?Db=gene&Cmd=DetailsSearch&Term=22827,https://www.uniprot.org/uniprot/Q9UHX1,https://www.genecards.org/cgi-bin/carddisp.pl?gene=PUF60,https://string-db.org/network/9606.ENSP00000434359,13
Prp8,PRPF8,pre-mRNA processing factor 8,ENSG00000174231,"It plays a role in pre-mRNA splicing as a major component of pre-catalytic, catalytic, and post-catalytic spliceosomal complexes, both the predominant U2-type spliceosome and the minor U12-type spliceosomal. Required for assembling the U4 / U6-U5 tri-snRNP complex, a building block of the spliceosome. It functions as a scaffold that positions spliceosomal U2, U5, and U6 snRNAs at splice sites on pre-mRNA substrates so that splicing can occur. Interacts with 5' and 3' splice locations.",B Complex and U5 snRNA,yes,"Luo HR, Moreau GA, Levin N, Moore MJ. The human Prp8 protein is a component of both U2- and U12-dependent spliceosomes. RNA. 1999;5(7):893–908. 
Wickramasinghe VO, Gonzàlez-Porta M, Perera D, Bartolozzi AR, Sibley CR, Hallegger M, et al. Regulation of constitutive and alternative mRNA splicing across the human transcriptome by PRPF8 is determined by 5’ splice site strength. Genome Biol. 2015 Sep 21;16(1):1–21. 
Zhang X, Zhan X, Yan C, Zhang W, Liu D, Lei J, et al. Structures of the human spliceosomes before and after release of the ligated exon. Cell Res. 2019 Apr 1;29(4):274–85.
",https://www.ncbi.nlm.nih.gov/gene?Db=gene&Cmd=DetailsSearch&Term=10594,https://www.uniprot.org/uniprot/Q6P2Q9,https://www.genecards.org/cgi-bin/carddisp.pl?gene=PRPF8,https://string-db.org/network/9606.ENSP00000460348,16
9G8,SRSF7,serine and arginine rich splicing factor 7,ENSG00000115875,It has the RS domain which is rich in serine and arginine residues and facilitates the interaction between different SR splicing factors. Represses MAPT / Tau exon 10 splicing.,"E, A, B, Bact, B*, C, C* complex",yes/reactome,"Popielarz M, Cavaloc Y, Mattei MG, Gattoni R, Stevenin J. The gene encoding human splicing factor 9G8: Structure, chromosomal localization, and expression of alternatively processed transcripts. J Biol Chem. 1995 Jul 28;270(30):17830–5. 
Ding S, Shi J, Qian W, Iqbal K, Grundke-Iqbal I, Gong CX, et al. Regulation of alternative splicing of tau exon 10 by 9G8 and Dyrk1A. Neurobiol Aging. 2012 Jul 1;33(7):1389–99. 
Huang Y, Steitz JA. Splicing factors SRp20 and 9G8 promote the nucleocytoplasmic export of mRNA. Mol Cell. 2001 Apr 1;7(4):899–905. 
",https://www.ncbi.nlm.nih.gov/gene?Db=gene&Cmd=DetailsSearch&Term=6432,https://www.uniprot.org/uniprot/Q16629,https://www.genecards.org/cgi-bin/carddisp.pl?gene=SRSF7,https://string-db.org/network/9606.ENSP00000325905,18
FMRP,FMR1,fragile X mental retardation 1,ENSG00000102081,"A multifunctional polyribosome-associated RNA-binding protein that plays a central role in neuronal development and synaptic plasticity through regulation of alternative mRNA splicing, mRNA stability, dendritic transport of mRNA, and subset postsynaptic site protein synthesis of mRNAs. It plays a role in alternative splicing of its own mRNA. Binds to consensus sequences 5'-ACU [GU]-3' and/or 5' - [AU] GGA-3'RNA within mRNA targets, mainly in the coding sequence (CDS) and in the 3' region -untranslated (UTR) and less frequently in 5'-UTR. It binds to intramolecular G-quadruplex structures at 5'- or 3'-UTR mRNA targets. Binds mRNAs containing U-rich target sequences.",Not identified,no,"Didiot MC, Tian Z, Schaeffer C, Subramanian M, Mandel JL, Moine H. The G-quartet containing FMRP binding site in FMR1 mRNA is a potent exonic splicing enhancer. Nucleic Acids Res. 2008 Sep 1;36(15):4902–12. 
Antar LN, Li C, Zhang H, Carroll RC, Bassell GJ. Local functions for FMRP in axon growth cone motility and activity-dependent regulation of filopodia and spine synapses. Mol Cell Neurosci. 2006 May 1;32(1–2):37–48. 
",https://www.ncbi.nlm.nih.gov/gene?Db=gene&Cmd=DetailsSearch&Term=2332,https://www.uniprot.org/uniprot/Q06787,https://www.genecards.org/cgi-bin/carddisp.pl?gene=FMR1,https://string-db.org/network/9606.ENSP00000359506,13
HnRNP A0,HNRNPA0,heterogeneous nuclear ribonucleoprotein A0,ENSG00000177733,mRNA binding component of ribonucleosomes. It specifically binds to mRNAs containing AU-rich elements (ARE). Involved in post-transcriptional regulation of cytokine mRNAs.,"E, A and B complex",yes/reactome,"Lee BP, Pilling LC, Bandinelli S, Ferrucci L, Melzer D, Harries LW. The transcript expression levels of HNRNPM, HNRNPA0 and AKAP17A splicing factors may be predictively associated with ageing phenotypes in human peripheral blood. Biogerontology. 2019 Oct 15;20(5):649–63. 
Rousseau S, Morrice N, Peggie M, Campbell DG, Gaestel M, Cohen P. Inhibition of SAPK2a/p38 prevents hnRNP A0 phosphorylation by MAPKAP-K2 and its interaction with cytokine mRNAs. EMBO J. 2002 Dec 2;21(23):6505–14. 
",https://www.ncbi.nlm.nih.gov/gene?Db=gene&Cmd=DetailsSearch&Term=10949,https://www.uniprot.org/uniprot/Q13151,https://www.genecards.org/cgi-bin/carddisp.pl?gene=HNRNPA0,https://string-db.org/network/9606.ENSP00000316042,6
HnRNP A2/HnRNP B1,HNRNPA2B1,heterogeneous nuclear ribonucleoprotein A2/B1,ENSG00000122566,"Heterogeneous nuclear ribonucleoprotein (hnRNP) that associates with nascent pre-mRNAs, packaging them into hnRNP particles, important for pre-mRNA processing. It acts as a regulator of the efficiency of mRNA splicing, possibly by binding to pre-mRNAs containing m6A. It has been reported that inhibition of apoptosis and increased cell proliferation induced by IE86 may be related to alternative splicing of Bcl-x mediated by hnRNP A2/B1.","E, A and B complex",yes/reactome,"Alarcón CR, Goodarzi H, Lee H, Liu X, Tavazoie S, Tavazoie SF. HNRNPA2B1 Is a Mediator of m6A-Dependent Nuclear RNA Processing Events. Cell. 2015 Sep 10;162(6):1299–308. 
Zhao R, Hu M, Liang S, Wang B, Yu B, Yang G, et al. IE86 Inhibits the apoptosis and promotes the cell proliferation of glioma cells via the hnRNP A2/B1-mediated alternative splicing of Bcl-x. Int J Clin Exp Pathol. 2019;12(7):2775–85. 
He Y, Smith R. Nuclear functions of heterogeneous nuclear ribonucleoproteins A/B. Vol. 66, Cellular and Molecular Life Sciences. Springer; 2009. p. 1239–56. 
",https://www.ncbi.nlm.nih.gov/gene?Db=gene&Cmd=DetailsSearch&Term=3181,https://www.uniprot.org/uniprot/P22626,https://www.genecards.org/cgi-bin/carddisp.pl?gene=HNRNPA2B1,,20
HnRNP C1/C2,HNRNPC,heterogeneous nuclear ribonucleoprotein C (C1/C2),ENSG00000092199,"HnRNP C is a nuclear RNA-binding protein that binds to nascent mRNA transcripts, which plays roles in pre-mRNA splicing, mRNA stability, and translational modulation. Binds pre-mRNA and nucleates the 40S hnRNP particle assembly. It interacts with poly-U tracts in the 3'-UTR or 5'-UTR of mRNA and modulates the stability and translational level of bound mRNA molecules. It may play a role in the early stages of spliceosome assembly and pre-mRNA splicing. It has been reported that hnRNP C is the master regulator of the alternative exon 10 skipping of the human MUSK gene along with the factors YB-1 and hnRNP L.","E, A and B complex",yes/reactome,"Nasrin F, Rahman MA, Masuda A, Ohe K, Takeda JI, Ohno K. HnRNP C, YB-1 and hnRNP L coordinately enhance skipping of human musk exon 10 to generate a wnt-insensitive musk isoform. Sci Rep. 2014 Oct 30;4(1):1–11. 
Cieniková Z, Jayne S, Damberger FF, Allain FHT, Maris C. Evidence for cooperative tandem binding of hnRNP C RRMs in mRNA processing. RNA. 2015 Nov 1;21(11):1931–42. 
Sébillon P, Beldjord C, Kaplan J claude, Brody E, Marie J. A T to G mutation in the polypyrimidine tract of the second intron of the human β-globin gene reduces in vitro splicing efficiency: Evidence for an increased hnRNP c interaction. Nucleic Acids Res. 1995 Sep 11;23(17):3419–25.
",https://www.ncbi.nlm.nih.gov/gene?Db=gene&Cmd=DetailsSearch&Term=3183,https://www.uniprot.org/uniprot/P07910,https://www.genecards.org/cgi-bin/carddisp.pl?gene=HNRNPC,https://string-db.org/network/9606.ENSP00000451291,17
HnRNP-E1,PCBP1,poly(rC) binding protein 1,ENSG00000169564,"It contains three K-homologous (KH) domains that may be involved in RNA binding. Enhanced PCBP1 expression was reported to inhibit expression of CD44 variants including v3, v5, v6, v8 and v10 in HepG2 cells, and endogenous PCBP1 knockdown induced splicing of these variants.","E, A and B complex",yes/reactome,"Zhang T, Huang XH, Dong L, Hu D, Ge C, Zhan YQ, et al. PCBP-1 regulates alternative splicing of the CD44 gene and inhibits invasion in human hepatoma cell line HepG2 cells. Mol Cancer. 2010 Apr 2;9(1):1–10. 
Chen Q, Gu M, Cai Z kang, Zhao H, Sun S cheng, Liu C, et al. TGF-β1 promotes epithelial-to-mesenchymal transition and stemness of prostate cancer cells by inducing PCBP1 degradation and alternative splicing of CD44. Cell Mol Life Sci. 2021 Feb 1;78(3):949–62. 
Meng Q, Rayala SK, Gururaj AE, Talukder AH, O’Malley BW, Kumar R. Signaling-dependent and coordinated regulation of transcription, splicing, and translation resides in a single coregulator, PCBP1. Proc Natl Acad Sci U S A. 2007 Apr 3;104(14):5866–71. 
",https://www.ncbi.nlm.nih.gov/gene?Db=gene&Cmd=DetailsSearch&Term=5093,https://www.uniprot.org/uniprot/Q15365,https://www.genecards.org/cgi-bin/carddisp.pl?gene=PCBP1,https://string-db.org/network/9606.ENSP00000305556,6
HnRNP-E2,PCBP2,poly(rC) binding protein 2,ENSG00000197111,"Along with PCBP-1 and hnRNPK, it is one of the major cellular poly (rC) binding proteins. The encoded protein contains three K-homologous (KH) domains that may be involved in RNA binding.","E, A and B complex",yes/reactome,"Georgiadou D, Boussata S, Keijser R, Janssen DAM, Afink GB, van Dijk M. Knockdown of Splicing Complex Protein PCBP2 Reduces Extravillous Trophoblast Differentiation Through Transcript Switching. Front Cell Dev Biol. 2021 May 20;9:1019. 
Wang X, Guo Q, Wang H, Yuan X, Wang B, Lobie PE, et al. PCBP2 posttranscriptional modifications induce breast cancer progression via upregulation of UFD1 and NT5E. Mol Cancer Res. 2021 Jan 1;19(1):86–98. 
",https://www.ncbi.nlm.nih.gov/gene?Db=gene&Cmd=DetailsSearch&Term=5094,https://www.uniprot.org/uniprot/Q15366,https://www.genecards.org/cgi-bin/carddisp.pl?gene=PCBP2,https://string-db.org/network/9606.ENSP00000352438,15
HnRNP-G,RBMX,"RNA binding motif protein, X-linked",ENSG00000147274,An RNA-binding protein that plays several roles in regulating pre- and post-transcriptional processes. Component of the suprapliceosomal complex that regulates alternative pre-mRNA splice site selection. Can enable or suppress exon inclusion; it acts additively with TRA2B to promote the inclusion of exon 7 of the survival motor neuron SMN2. Represses MAPT / Tau exon 10 splicing. It binds preferentially to the 5' motif of -CC-rich RNAs [A/C] located in a single-stranded conformation.,"E, A and B complex",yes/reactome,"Hofmann Y, Wirth B. hnRNP-G promotes exon 7 inclusion of survival motor neuron (SMN) via direct interaction with Htra2-β1. Hum Mol Genet. 2002 Aug 15;11(17):2037–49. 
Kanhoush R, Beenders B, Perrin C, Moreau J, Bellini M, Penrad-Mobayed M. Novel domains in the hnRNP G/RBMX protein with distinct roles in RNA binding and targeting nascent transcripts. Nucleus. 2010;1(1):109–22. 
Heinrich B, Zhang Z, Raitskin O, Hiller M, Benderska N, Hartmann AM, et al. Heterogeneous nuclear ribonucleoprotein G regulates splice site selection by binding to CC(A/C)-rich regionsin pre-mRNA. J Biol Chem. 2009 May 22;284(21):14303–15. 
",https://www.ncbi.nlm.nih.gov/gene?Db=gene&Cmd=DetailsSearch&Term=27316,https://www.uniprot.org/uniprot/P38159,https://www.genecards.org/cgi-bin/carddisp.pl?gene=RBMX,https://string-db.org/network/9606.ENSP00000359645,14
HnRNPH,HNRNPH1,heterogeneous nuclear ribonucleoprotein H1 (H),ENSG00000169045,"This protein is a component of the heterogeneous nuclear ribonucleoprotein (hnRNP) complexes that provide the substrate for pre-mRNA splicing events. It mediates the regulation of pre-mRNA alternative splicing. It inhibits, together with CUGBP1, the inclusion of exon 11 of the insulin receptor (IR) pre-mRNA in the myoblast. Poly alloy (RG). It has been proposed that hnRNP H1 plays a crucial role in regulating alternative splicing of the rpL3 gene.","E, A and B complex",yes/reactome,"Pilch J, Koppolu AA, Walczak A, Murcia Pienkowski VA, Biernacka A, Skiba P, et al. Evidence for HNRNPH1 being another gene for Bain type syndromic mental retardation. Clin Genet. 2018 Oct 1;94(3–4):381–5. 
Russo A, Siciliano G, Catillo M, Giangrande C, Amoresano A, Pucci P, et al. hnRNP H1 and intronic G runs in the splicing control of the human rpL3 gene. Biochim Biophys Acta - Gene Regul Mech. 2010 May 1;1799(5–6):419–28. 
Russo A, Catillo M, Esposito D, Briata P, Pietropaolo C, Russo G. Autoregulatory circuit of human rpL3 expression requires hnRNP H1, NPM and KHSRP. Nucleic Acids Res. 2011 Sep 1;39(17):7576–85. 
",https://www.ncbi.nlm.nih.gov/gene?Db=gene&Cmd=DetailsSearch&Term=3187,https://www.uniprot.org/uniprot/P31943,https://www.genecards.org/cgi-bin/carddisp.pl?gene=HNRNPH1,https://string-db.org/network/9606.ENSP00000349168,17
HnRNP H3/2H9,HNRNPH3,heterogeneous nuclear ribonucleoprotein H3,ENSG00000096746,"Involved in the splicing process and participates in the early termination of splicing induced by thermal shock. Due to their large structural variations, the different isoforms can play different roles in the splicing reaction.",Not identified,no,"Mahé D, Mähl P, Gattoni R, Fischer N, Mattei MG, Stévenin J, et al. Cloning of human 2H9 heterogeneous nuclear ribonucleoproteins: Relation with splicing and early heat shock-induced splicing arrest. J Biol Chem. 1997 Jan 17;272(3):1827–36. 
Honoré B. The hnRNP 2H9 gene, which is involved in the splicing reaction, is a multiply spliced gene. Biochim Biophys Acta - Gene Struct Expr. 2000 Jun 21;1492(1):108–19. 
",https://www.ncbi.nlm.nih.gov/gene?Db=gene&Cmd=DetailsSearch&Term=3189,https://www.uniprot.org/uniprot/P31942,https://www.genecards.org/cgi-bin/carddisp.pl?gene=HNRNPH3,https://string-db.org/network/9606.ENSP00000265866,17
HnRNP K,HNRNPK,heterogeneous nuclear ribonucleoprotein K,ENSG00000165119,"One of the main pre-mRNA binding proteins. It binds tightly to poly(C) sequences. They likely play a role in the nuclear metabolism of hnRNAs, particularly for pre-mRNAs that contain cytidine-rich sequences. hnRNPK has been reported as a critical splicing regulator of MRPL33 pre-mRNA in cancer cells.","E, A and B complex",yes/reactome,"Hong X, Song R, Song H, Zheng T, Wang J, Liang Y, et al. PTEN antagonises Tcl1/hnRNPK-mediated G6PD pre-mRNA splicing which contributes to hepatocarcinogenesis. Gut. 2014 Oct 1;63(10):1635–47. 
Liu L, Luo C, Luo Y, Chen L, Liu Y, Wang Y, et al. MRPL33 and its splicing regulator hnRNPK are required for mitochondria function and implicated in tumor progression. Oncogene. 2018 Jan 4;37(1):86–94. 
",https://www.ncbi.nlm.nih.gov/gene?Db=gene&Cmd=DetailsSearch&Term=3190,https://www.uniprot.org/uniprot/P61978,https://www.genecards.org/cgi-bin/carddisp.pl?gene=HNRNPK,https://string-db.org/network/9606.ENSP00000365439,20
HNRNPM,HNRNPM,heterogeneous nuclear ribonucleoprotein M,ENSG00000099783,The pre-mRNA binding protein in vivo avidly binds to poly(G) and poly(U) RNA homopolymers in vitro. hnRNP-M affects alternate splice site choices of 5 ′ and 3 ′.,"E, A and B complex",yes/reactome,"Gattoni R, Mahé D, Mähl P, Fischer N, Mattei MG, Stévenin J, et al. The human hnRNP-M proteins: Structure and relation with early heat shock-induced splicing arrest and chromosome mapping. Nucleic Acids Res. 1996 Jul 1;24(13):2535–42. 
Ho JS, Di Tullio F, Schwarz M, Low D, Incarnato D, Gay F, et al. HNRNPM controls circRNA biogenesis and splicing fidelity to sustain cancer cell fitness. Elife. 2021 Jun 2;10. 
Llères D, Denegri M, Biggiogera M, Ajuh P, Lamond AI. Direct interaction between hnRNP-M and CDC5L/PLRG1 proteins affects alternative splice site choice. EMBO Rep. 2010 Jun 1;11(6):445–51. 
",https://www.ncbi.nlm.nih.gov/gene?Db=gene&Cmd=DetailsSearch&Term=4670,https://www.uniprot.org/uniprot/P52272,https://www.genecards.org/cgi-bin/carddisp.pl?gene=HNRNPM,https://string-db.org/network/9606.ENSP00000325376,11
HnRNP-Q,SYNCRIP,synaptotagmin binding cytoplasmic RNA interacting protein,ENSG00000135316,"Heterogeneous nuclear ribonucleoprotein (hnRNP) implicated in mRNA processing mechanisms. Component of the CRD-mediated complex that promotes the stability of MYC mRNA. Isoform 1, isoform 2 and isoform 3 are associated in vitro with pre-mRNA, splicing intermediates and mature mRNA protein complexes. Isoform 1 binds to AU-rich sequences of apoB mRNA. It interacts in vitro preferentially with poly(A) and poly(U) RNA sequences.",Not identified,no,"Rizzo F, Nizzardo M, Vashisht S, Molteni E, Melzi V, Taiana M, et al. Key role of SMN/SYNCRIP and RNA-Motif 7 in spinal muscular atrophy: RNA-Seq and motif analysis of human motor neurons. Brain. 2019 Feb 1;142(2):276–94. 
Chen H-H, Chang J-G, Lu R-M, Peng T-Y, Tarn W-Y.  The RNA Binding Protein hnRNP Q Modulates the Utilization of Exon 7 in the Survival Motor Neuron 2 ( SMN2 ) Gene . Mol Cell Biol. 2008 Nov 15;28(22):6929–38. 
",https://www.ncbi.nlm.nih.gov/gene?Db=gene&Cmd=DetailsSearch&Term=10492,https://www.uniprot.org/uniprot/O60506,https://www.genecards.org/cgi-bin/carddisp.pl?gene=SYNCRIP,https://string-db.org/network/9606.ENSP00000358635,17
HnRNP U,HNRNPU,heterogeneous nuclear ribonucleoprotein U,ENSG00000153187,"It plays a role as a regulator of holoenzyme transcription of RNA polymerase II (Pol II). It plays a role as an alternative global pre-mRNA splicing modulator, regulating the biogenesis of the small nuclear ribonucleoprotein U2 (snRNP). It binds to the 3'-UTR of TNFA mRNA.","E, A, B, Bact, B*, C, C* complex",yes/reactome,"Xiao R, Tang P, Yang B, Huang J, Zhou Y, Shao C, et al. Nuclear Matrix Factor hnRNP U/SAF-A Exerts a Global Control of Alternative Splicing by Regulating U2 snRNP Maturation. Mol Cell. 2012 Mar 9;45(5):656–68. 
Xing S, Li Z, Ma W, He X, Shen S, Wei H, et al. DIS3L2 promotes progression of hepatocellular carcinoma via hnRNP U-mediated alternative splicing. Cancer Res. 2019 Oct 1;79(19):4923–36. 
Meininger I, Griesbach RA, Hu D, Gehring T, Seeholzer T, Bertossi A, et al. Alternative splicing of MALT1 controls signalling and activation of CD4 + T cells. Nat Commun. 2016 Apr 12;7(1):1–15. 
",https://www.ncbi.nlm.nih.gov/gene?Db=gene&Cmd=DetailsSearch&Term=3192,https://www.uniprot.org/uniprot/Q00839,https://www.genecards.org/cgi-bin/carddisp.pl?gene=HNRNPU,https://string-db.org/network/9606.ENSP00000283179,18
HUC,ELAVL3,ELAV like RNA binding protein 3,ENSG00000196361,"ELAV-like 3 is a neuron-specific RNA-binding protein that contains three RNP-like RNA recognition motifs. It binds to AU-rich element (ARE) sequences of target mRNAs, including VEGF mRNA.",Not identified,no,"Zhu H, Hasman RA, Barron VA, Luo G, Lou H. A nuclear function of Hu proteins as neuron-specific alternative RNA processing regulators. Mol Biol Cell. 2006 Dec 11;17(12):5105–14. 
Wang H, Molfenter J, Zhu H, Lou H. Promotion of exon 6 inclusion in HuD pre-mRNA by Hu protein family members. Nucleic Acids Res. 2010 Feb 16;38(11):3760–70. 
",https://www.ncbi.nlm.nih.gov/gene?Db=gene&Cmd=DetailsSearch&Term=1995,https://www.uniprot.org/uniprot/Q14576,https://www.genecards.org/cgi-bin/carddisp.pl?gene=ELAVL3,https://string-db.org/network/9606.ENSP00000352162,9
HUD,ELAVL4,ELAV like RNA binding protein 4,ENSG00000162374,"An RNA binding protein that is involved in the post-transcriptional regulation of mRNAs. It binds to AU rich element (ARE) sequences in the 3' untranslated region (UTR) of target mRNAs, including GAP43, VEGF, FOS, CDKN1A and ACHE mRNA. By binding to 3'UTR mRNA, it decreases mRNA deadenylation. it also binds to the polyadenylated tail (poly(A)) in the 3'UTR of the mRNA, thus increasing its affinity for mRNA binding. It acts as a stabilizing factor by binding to NOVA1 3'UTR mRNA, thus increasing its translation and enhancing its functional activity in neuron-specific splicing. It can regulate alternative splicing of CALCA pre-mRNA to calcitonin and calcitonin gene-related peptide 1 (CGRP) by competing with the splicing regulator TIAR for binding to U-rich intronic sequences of CALCA pre-mRNA.",Not identified,no,"Zhu H, Hasman RA, Barron VA, Luo G, Lou H. A nuclear function of Hu proteins as neuron-specific alternative RNA processing regulators. Mol Biol Cell. 2006 Dec 11;17(12):5105–14. 
Wang H, Molfenter J, Zhu H, Lou H. Promotion of exon 6 inclusion in HuD pre-mRNA by Hu protein family members. Nucleic Acids Res. 2010 Feb 16;38(11):3760–70. 
Ross RA, Lazarova DL, Manley GT, Smitt PS, Spengler BA, Posner JB, et al. HuD, a neuronal-specific RNA-binding protein, is a potential regulator of MYCN expression in human neuroblastoma cells. In: European Journal of Cancer. Elsevier; 1997. p. 2071–4. 
",https://www.ncbi.nlm.nih.gov/gene?Db=gene&Cmd=DetailsSearch&Term=1996,https://www.uniprot.org/uniprot/P26378,https://www.genecards.org/cgi-bin/carddisp.pl?gene=ELAVL4,https://string-db.org/network/9606.ENSP00000349594,16
HuR,ELAVL1,ELAV like RNA binding protein 1,ENSG00000066044,"RNA binding protein that binds to the 3'-UTR region of mRNAs and increases their stability. It binds to poly-U elements and AU-rich elements (AREs) in the 3'-UTR of target mRNAs. With ZNF385A, it binds the 3'-UTR of p53 / TP53 mRNA to control its CDKN2A-induced nuclear export. Therefore, it can regulate the expression of p53 / TP53 and mediate in part the antiproliferative activity of CDKN2A. It can also bind CCNB1 mRNA with ZNF385A.","A, B, Bact, B*, C, C* complex",yes/reactome,"Grammatikakis I, Abdelmohsen K, Gorospe M. Posttranslational control of HuR function. Vol. 8, Wiley Interdisciplinary Reviews: RNA. Blackwell Publishing Ltd; 2017. p. e1372. 
Shang J, Zhao Z. Emerging role of HuR in inflammatory response in kidney diseases. Vol. 49, Acta Biochimica et Biophysica Sinica. Oxford University Press; 2017. p. 753–63. 
Akaike Y, Masuda K, Kuwano Y, Nishida K, Kajita K, Kurokawa K, et al.  HuR Regulates Alternative Splicing of the TRA2 β Gene in Human Colon Cancer Cells under Oxidative Stress . Mol Cell Biol. 2014 Aug;34(15):2857–73
",https://www.ncbi.nlm.nih.gov/gene?Db=gene&Cmd=DetailsSearch&Term=1994,https://www.uniprot.org/uniprot/Q15717,https://www.genecards.org/cgi-bin/carddisp.pl?gene=ELAVL1,https://string-db.org/network/9606.ENSP00000385269,14
