Protein-name,gene-symbol,gene-name,ensembl-code,gene-description,spliceosomal-class,validated-class,splicing-references,ncbi-link,uniprot-link,genecards-link,string-db-link,gtex-ens-version
CHD-1,CHD1,chromodomain helicase DNA binding protein 1,ENSG00000153922,It interacts with methylated H3K4 facilitating pre-mRNA maturation capacity through the recruitment of spliceosome components to H3K4me3. CHD1 connects the spliceosomal components of the nucleus to H3K4me3 through specific interactions with the SF3a subcomplex of U2 snRNP.,U2 snRNP related,no,"Sims RJ, Millhouse S, Chen CF, Lewis BA, Erdjument-Bromage H, Tempst P, et al. Recognition of Trimethylated Histone H3 Lysine 4 Facilitates the Recruitment of Transcription Postinitiation Factors and Pre-mRNA Splicing. Mol Cell. 2007 Nov 30;28(4):665–76. 
Schüler A, Ghanbarian AT, Hurst LD. Purifying selection on splice-related motifs, not expression level nor RNA folding, explains nearly all constraint on human lincRNAs. Mol Biol Evol. 2014 Dec 1;31(12):3164–83. 
",https://www.ncbi.nlm.nih.gov/gene?Db=gene&Cmd=DetailsSearch&Term=1105,https://www.uniprot.org/uniprot/O14646,https://www.genecards.org/cgi-bin/carddisp.pl?gene=CHD1,https://string-db.org/network/9606.ENSP00000483667,10
CCCTC,CTCF,CCCTC-binding factor,ENSG00000102974,"It may have a role in regulating alternative exon use during splicing through its functional relationship with intragenic chromatin looping, particularly in regulating the inclusion of domains in proteins involved in cellular signaling and stress response. Furthermore, CTCF has been reported to interact with splicing factors, including snRNPs, hnRNPs, serine-arginine proteins.",Not identified,no,"Ruiz-Velasco M, Kumar M, Lai MC, Bhat P, Solis-Pinson AB, Reyes A, et al. CTCF-Mediated Chromatin Loops between Promoter and Gene Body Regulate Alternative Splicing across Individuals. Cell Syst. 2017 Dec 27;5(6):628-637.e6. 
Lehman BJ, Lopez-Diaz FJ, Santisakultarm TP, Fang L, Shokhirev MN, Diffenderfer KE, et al. Dynamic regulation of CTCF stability and subnuclear localization in response to stress. PLoS Genet. 2021 Jan 7;17(1):e1009277. 
Marina RJ, Sturgill D, Bailly MA, Thenoz M, Varma G, Prigge MF, et al.  TET ‐catalyzed oxidation of intragenic 5‐methylcytosine regulates CTCF ‐dependent alternative splicing . EMBO J. 2016 Feb 1;35(3):335–55.",https://www.ncbi.nlm.nih.gov/gene/10664,https://www.uniprot.org/uniprot/P49711,https://www.genecards.org/cgi-bin/carddisp.pl?gene=CTCF,https://string-db.org/network/9606.ENSP00000264010,14
Prp5,DDX46,DEAD-box helicase 46,ENSG00000145833,Involved in spliceosome assembly and is a component of the 17S U2 snRNP complex. It can facilitate the stable binding of introns to U2 snRNP by modulating intron selectivity.,U2 snRNP ,yes,"Xu YZ, Query CC. Competition between the ATPase Prp5 and Branch Region-U2 snRNA Pairing Modulates the Fidelity of Spliceosome Assembly. Mol Cell. 2007 Dec 14;28(5):838–49. 
Will CL, Urlaub H, Achsel T, Gentzel M, Wilm M, Lührmann R. Characterization of novel SF3b and 17S U2 snRNP proteins, including a human Prp5p homologue and an SF3b DEAD-box protein. EMBO J. 2002 Sep 16;21(18):4978–88. 
",https://www.ncbi.nlm.nih.gov/gene?Db=gene&Cmd=DetailsSearch&Term=9879,https://www.uniprot.org/uniprot/Q7L014,https://www.genecards.org/cgi-bin/carddisp.pl?gene=DDX46,,15
Prp16 ,DHX38,DEAH-box helicase 38,ENSG00000140829,Involved in pre-mRNA splicing as a component of the spliceosome. It is an ATPase and essential for catalytic step II in the pre-mRNA splicing process. It is connected to the spliceosome nucleus mainly through interactions with CCDC49 and CCDC94 during the first catalytic step of splicing.,C complex,yes,"Zhan X, Yan C, Zhang X, Lei J, Shi Y. Structure of a human catalytic step I spliceosome. Science (80- ). 2018 Feb 2;359(6375):537–45. 
Zhou Z, Reed R. Human homologs of yeast Prp16 and Prp17 reveal conservation of the mechanism for catalytic step II of pre-mRNA splicing. EMBO J. 1998 Apr 1;17(7):2095–106. 
Wang Y, Guthrie C. PRP16, a DEAH-box RNA helicase, is recruited to the spliceosome primarily via its nonconserved N-terminal domain. RNA. 1998 Oct;4(10):1216–29. 
",https://www.ncbi.nlm.nih.gov/gene/9785,https://www.uniprot.org/uniprot/Q92620,https://www.genecards.org/cgi-bin/carddisp.pl?gene=DHX38,https://string-db.org/network/9606.ENSP00000268482,11
Prp22,DHX8,DEAH-box helicase 8,ENSG00000067596,Involved in pre-mRNA splicing as a component of the spliceosome. It functions as an ATP-dependent RNA helicase that facilitates the nuclear export of mRNA by releasing RNA from the spliceosome.,C* complex and P Complex,yes,"Mayas RM, Maita H, Staley JP. Exon ligation is proofread by the DExD/H-box ATPase Prp22p. Nat Struct Mol Biol. 2006 Jun 26;13(6):482–90. 
Zhang X, Yan C, Hang J, Finci LI, Lei J, Shi Y. An Atomic Structure of the Human Spliceosome. Cell. 2017 May 18;169(5):918-929.e14. 
Bertram K, Agafonov DE, Liu WT, Dybkov O, Will CL, Hartmuth K, et al. Cryo-EM structure of a human spliceosome activated for step 2 of splicing. Nature. 2017 Feb 16;542(7641):318–23. 
",https://www.ncbi.nlm.nih.gov/gene/1659,https://www.uniprot.org/uniprot/Q14562,https://www.genecards.org/cgi-bin/carddisp.pl?gene=DHX8,https://string-db.org/network/9606.ENSP00000262415,10
RBM35A,ESRP1,epithelial splicing regulatory protein 1,ENSG00000104413,"It is an epithelial-specific RNA-binding protein and promotes splicing of epithelial variants of the ENAH, CD44 and CTNND1 transcripts. It further specifically regulates the expression of FGFR2-IIIb, a specific epithelial cell isoform of FGFR2. It has been reported as an important factor in the splicing of the CD44 gene and induction of the CD44 v3 isoform, associated with the pluripotency control of human PSC (pluripotent stem cells).",Not identified,no,"Warzecha CC, Sato TK, Nabet B, Hogenesch JB, Carstens RP. ESRP1 and ESRP2 Are Epithelial Cell-Type-Specific Regulators of FGFR2 Splicing. Mol Cell. 2009 Mar 13;33(5):591–601. 
Warzecha CC, Shen S, Xing Y, Carstens RP. The epithelial splicing factors ESRP1 and ESRP2 positively and negatively regulate diverse types of alternative splicing events. RNA Biol. 2009;6(5):546–62. 
Kim YD, Kim HS, Lee J, Choi JK, Han E, Jeong JE, et al. ESRP1-Induced CD44 v3 Is Important for Controlling Pluripotency in Human Pluripotent Stem Cells. Stem Cells. 2018 Oct 1;36(10):1525–34. 
",https://www.ncbi.nlm.nih.gov/gene?Db=gene&Cmd=DetailsSearch&Term=54845,https://www.uniprot.org/uniprot/Q6NXG1,https://www.genecards.org/cgi-bin/carddisp.pl?gene=ESRP1,https://string-db.org/network/9606.ENSP00000405738,15
RBM35B,ESRP2,epithelial splicing regulatory protein 2,ENSG00000103067,"It is an epithelial-specific RNA-binding protein and promotes splicing of epithelial variants of the ENAH, CD44 and CTNND1 transcripts. It further specifically regulates the expression of FGFR2-IIIb, a specific epithelial cell isoform of FGFR2.",Not identified,no,"Warzecha CC, Sato TK, Nabet B, Hogenesch JB, Carstens RP. ESRP1 and ESRP2 Are Epithelial Cell-Type-Specific Regulators of FGFR2 Splicing. Mol Cell. 2009 Mar 13;33(5):591–601. 
Warzecha CC, Shen S, Xing Y, Carstens RP. The epithelial splicing factors ESRP1 and ESRP2 positively and negatively regulate diverse types of alternative splicing events. RNA Biol. 2009;6(5):546–62. 
Bhate A, Parker DJ, Bebee TW, Ahn J, Arif W, Rashan EH, et al. ESRP2 controls an adult splicing programme in hepatocytes to support postnatal liver maturation. Nat Commun. 2015 Nov 4;6(1):1–12. 
",https://www.ncbi.nlm.nih.gov/gene?Db=gene&Cmd=DetailsSearch&Term=80004,https://www.uniprot.org/uniprot/Q9H6T0,https://www.genecards.org/cgi-bin/carddisp.pl?gene=ESRP2,https://string-db.org/network/9606.ENSP00000418748,13
SIP1,GEMIN2,gem nuclear organelle associated protein 2,ENSG00000092208,"It plays an important role in the splicing of cellular pre-mRNAs, catalyzing the assembly of small nuclear ribonucleoproteins (snRNPs), the building blocks of the spliceosome.",SMN/ Sm complex,yes,"Liu Q, Fischer U, Wang F, Dreyfuss G. The spinal muscular atrophy disease gene product, SMN, and its associated protein SIP1 are in a complex with spliceosomal snRNP proteins. Cell. 1997 Sep 19;90(6):1013–21. 
Chari A, Golas MM, Klingenhäger M, Neuenkirchen N, Sander B, Englbrecht C, et al. An Assembly Chaperone Collaborates with the SMN Complex to Generate Spliceosomal SnRNPs. Cell. 2008 Oct 31;135(3):497–509. 
",https://www.ncbi.nlm.nih.gov/gene?Db=gene&Cmd=DetailsSearch&Term=8487,https://www.uniprot.org/uniprot/O14893,https://www.genecards.org/cgi-bin/carddisp.pl?gene=GEMIN2,https://string-db.org/network/9606.ENSP00000308533,16
HnRNP-A1,HNRNPA1,heterogeneous nuclear ribonucleoprotein A1,ENSG00000135486,It is part of a complex of RNA-binding proteins that associate with pre-mRNAs in the nucleus and influence pre-mRNA processing as well as other aspects of mRNA metabolism and transport. It is one of the most abundant core proteins of the hnRNP complexes and plays a key role in the regulation of alternative splicing. Can modulate splice location selection. It has already been reported as an alternative splicing modulator of the HMGCR gene through exon definition.,"E, A and B complex",yes/reactome,"Lee YJ, Wang Q, Rio DC. Coordinate regulation of alternative pre-mRNA splicing events by the human RNA chaperone proteins hnRNPA1 and DDX5. Genes Dev. 2018 Aug 1;32(15–16):1060–74. 
Howard JM, Lin H, Wallace AJ, Kim G, Draper JM, Haeussler M, et al. HNRNPA1 promotes recognition of splice site decoys by U2AF2 in vivo. Genome Res. 2018 May 1;28(5):689–98. 
Yu CY, Theusch E, Lo K, Mangravite LM, Naidoo D, Kutilova M, et al. HNRNPA1 regulates HMGCR alternative splicing and modulates cellular cholesterol metabolism. Hum Mol Genet. 2014 Jan 15;23(2):319–32. 
",https://www.ncbi.nlm.nih.gov/gene?Db=gene&Cmd=DetailsSearch&Term=3178,https://www.uniprot.org/uniprot/P09651,https://www.genecards.org/cgi-bin/carddisp.pl?gene=HNRNPA1,https://string-db.org/network/9606.ENSP00000341826,17
HnRNP F,HNRNPF,heterogeneous nuclear ribonucleoprotein F,ENSG00000169813,"RNA-binding protein, component of heterogeneous nuclear ribonucleoprotein (hnRNP) complexes. It is associated with pre-mRNAs in the nucleus and regulates alternative splicing. It has three quasi-RRM domain repeats that bind to RNAs that have sequences rich in guanosine.","E, A and B complex",yes/reactome,"Huang H, Zhang J, Harvey SE, Hu X, Cheng C. RNA G-quadruplex secondary structure promotes alternative splicing via the RNA-binding protein hnRNPF. Genes Dev. 2017 Nov 30;31(22):2296–309. 
Dominguez C, Fisette JF, Chabot B, Allain FHT. Structural basis of G-tract recognition and encaging by hnRNP F quasi-RRMs. Nat Struct Mol Biol. 2010 Jul 6;17(7):853–61. 
",https://www.ncbi.nlm.nih.gov/gene/3185,https://www.uniprot.org/uniprot/P52597,https://www.genecards.org/cgi-bin/carddisp.pl?gene=HNRNPF,https://string-db.org/network/9606.ENSP00000400433,16
HnRNP L,HNRNPL,heterogeneous nuclear ribonucleoprotein L,ENSG00000104824,Component of heterogeneous nuclear ribonucleoprotein complexes (hnRNP) and associated with most nascent transcripts. It acts as an activator or repressor of exon inclusion. Displays a binding preference for CA-rich elements. It has been reported that hnRNP L RNA interactions in human T cells and identify the hnRNP L-dependent splicing regulation of cellular pathways as critical for T cell development and immune function. Another study reported that hnRNP L is the main protein responsible for ESS1-mediated exonic silencing.,"E, A and B complex",yes/reactome,"Shankarling G, Cole BS, Mallory MJ, Lynch KW. Transcriptome-Wide RNA Interaction Profiling Reveals Physical and Functional Targets of hnRNP L in Human T Cells. Mol Cell Biol. 2014 Jan;34(1):71–83. 
Hui J, Stangl K, Lane WS, Bindereiff A. HnRNP L stimulates splicing of the eNOS gene by binding to variable-length CA repeats. Nat Struct Biol. 2003 Jan 1;10(1):33–7. 
Liu G, Razanau A, Hai Y, Yu J, Sohail M, Lobo VG, et al. A conserved serine of heterogeneous nuclear ribonucleoprotein L (hnRNP L) mediates depolarization-regulated alternative splicing of potassium channels. J Biol Chem. 2012 Jun 29;287(27):22709–16. 
",https://www.ncbi.nlm.nih.gov/gene?Db=gene&Cmd=DetailsSearch&Term=3191,https://www.uniprot.org/uniprot/P14866,https://www.genecards.org/cgi-bin/carddisp.pl?gene=HNRNPL,https://string-db.org/network/9606.ENSP00000221419,16
HNRPLL,HNRNPLL,heterogeneous nuclear ribonucleoprotein L like,ENSG00000143889,"An RNA-binding protein that serves as an alternative splicing regulator for multiple target mRNAs, including PTPRC / CD45 and STAT5A. It has been shown that HnRNP L and LL cooperate in the CD45 pre-mRNA, binding to exons 4 and 6 and looping in exon 5, thus achieving total repression of the three variable exons.",Not identified,no,"Preußner M, Schreiner S, Hung LH, Porstner M, Jäck HM, Benes V, et al. HnRNP L and L-like cooperate in multiple-exon regulation of CD45 alternative splicing. Nucleic Acids Res. 2012 Jul 1;40(12):5666–78. 
Oberdoerffer S, Moita LF, Neems D, Freitas RP, Hacohen N, Rao A. Regulation of CD45 alternative splicing by heterogeneous ribonucleoprotein, hnRNPLL. Science (80- ). 2008 Aug 1;321(5889):686–91. 
",https://www.ncbi.nlm.nih.gov/gene?Db=gene&Cmd=DetailsSearch&Term=92906,https://www.uniprot.org/uniprot/Q8WVV9,https://www.genecards.org/cgi-bin/carddisp.pl?gene=HNRNPLL,https://version11.string-db.org/cgi/show_network_section.pl?taskId=oYkmJlxiduJI,15
MeCp-2,MECP2,methyl-CpG binding protein 2,ENSG00000169057,"MeCP2 binds to methylated exonic DNA, shutting down RNA Polymerase II (RNAPII), thus reducing the chance of skipping alternative exons. A functional analysis reveals that genes containing exons regulated by MeCP2 are primarily involved in synaptic functions and mRNA processing. It was also reported that MeCP2 regulated mRNA splicing through interaction with 5hmC and epigenetic changes in histone markers.",Not identified,no,"Maunakea AK, Chepelev I, Cui K, Zhao K. Intragenic DNA methylation modulates alternative splicing by recruiting MeCP2 to promote exon recognition. Cell Res. 2013 Nov 13;23(11):1256–69. 
Wong JJL, Gao D, Nguyen T V., Kwok CT, Van Geldermalsen M, Middleton R, et al. Intron retention is regulated by altered MeCP2-mediated splicing factor recruitment. Nat Commun. 2017 May 8;8(1):1–13. 
Cheng TL, Chen J, Wan H, Tang B, Tian W, Liao L, et al. Regulation of mRNA splicing by MeCP2 via epigenetic modifications in the brain. Sci Rep. 2017 Feb 17;7(1):1–12. 
",https://www.ncbi.nlm.nih.gov/gene?Db=gene&Cmd=DetailsSearch&Term=4204,https://www.uniprot.org/uniprot/P51608,https://www.genecards.org/cgi-bin/carddisp.pl?gene=MECP2,https://string-db.org/network/9606.ENSP00000395535,21
NOVA-1,NOVA1,NOVA alternative splicing regulator 1,ENSG00000139910,It can regulate RNA splicing or metabolism in a specific subset of developing neurons. Nova1 binds to YCAY-rich elements (where Y represents a pyrimidine) and is a central regulator of alternative neuronal splicing. It was further reported that Nova1 may have an alternative splicing master regulatory role in pancreatic beta cells.,Not identified,no,"Villate O, Turatsinze JV, Mascali LG, Grieco FA, Nogueira TC, Cunha DA, et al. Nova1 is a master regulator of alternative splicing in pancreatic beta cells. Nucleic Acids Res. 2014 Oct 13;42(18):11818–30. 
Ule J, Stefani G, Mele A, Ruggiu M, Wang X, Taneri B, et al. An RNA map predicting Nova-dependent splicing regulation. Nature. 2006 Nov 1;444(7119):580–6. 
Gumina V, Colombrita C, Fallini C, Bossolasco P, Maraschi AM, Landers JE, et al. TDP-43 and NOVA-1 RNA-binding proteins as competitive splicing regulators of the schizophrenia-associated TNIK gene. Biochim Biophys Acta - Gene Regul Mech. 2019 Sep 1;1862(9):194413. 
",https://www.ncbi.nlm.nih.gov/gene?Db=gene&Cmd=DetailsSearch&Term=4857 ,https://www.uniprot.org/uniprot/P51513,https://www.genecards.org/cgi-bin/carddisp.pl?gene=NOVA1,https://string-db.org/network/9606.ENSP00000438875,19
NOVA-2,NOVA2,NOVA alternative splicing regulator 2,ENSG00000104967,"It can regulate RNA splicing or metabolism in a specific subset of developing neurons. It binds directly to the YCAY motifs (where Y represents a pyrimidine) in the messenger RNA (mRNA) sequence. Depending on the location of the binding in the mRNA, it can induce exon skipping or exon retention.",Not identified,no,"Ule J, Stefani G, Mele A, Ruggiu M, Wang X, Taneri B, et al. An RNA map predicting Nova-dependent splicing regulation. Nature. 2006 Nov 1;444(7119):580–6. 
Mattioli F, Hayot G, Drouot N, Isidor B, Courraud J, Hinckelmann MV, et al. De Novo Frameshift Variants in the Neuronal Splicing Factor NOVA2 Result in a Common C-Terminal Extension and Cause a Severe Form of Neurodevelopmental Disorder. Am J Hum Genet. 2020 Apr 2;106(4):438–52. 
Belloni E, Di Matteo A, Pradella D, Vacca M, Wyatt CDR, Alfieri R, et al. Gene Expression Profiles Controlled by the Alternative Splicing Factor Nova2 in Endothelial Cells. Cells. 2019 Nov 23;8(12):1498. 
",https://www.ncbi.nlm.nih.gov/gene?Db=gene&Cmd=DetailsSearch&Term=4858,https://www.uniprot.org/uniprot/Q9UNW9,https://www.genecards.org/cgi-bin/carddisp.pl?gene=NOVA2,https://string-db.org/network/9606.ENSP00000263257,6
HNRNP-I,PTBP1,polypyrimidine tract binding protein 1,ENSG00000011304,It plays a role in pre-mRNA splicing and regulation of alternative splicing events. It activates exon skipping of its own pre-mRNA during muscle cell differentiation. This protein binds to intronic polypyrimidine tracts that require pre-mRNA splicing and acts through the ubiquitin-proteasome protein degradation pathway. It can also promote the binding of U2 snRNP to pre-mRNAs. It cooperates with RAVER1 to modulate the alternation between mutually exclusive exons during TPM1 pre-mRNA maturation. Represses MAPT / Tau exon 10 splicing.,"E, A and B complex",yes/reactome,"Oberstrass FC, Auwetor SD, Erat M, Hargous Y, Henning A, Wenter P, et al. Structural biology - Structure of PTB bound to RNA: Specific binding and implications for splicing regulation. Science (80- ). 2005 Sep 23;309(5743):2054–7. 
Li YI, Sanchez-Pulido L, Haerty W, Ponting CP. RBFOX and PTBP1 proteins regulate the alternative splicing of micro-exons in human brain transcripts. Vol. 25, Genome Research. Cold Spring Harbor Laboratory Press; 2015. p. 1–13. 
Sharma S, Kohlstaedt LA, Damianov A, Rio DC, Black DL. Polypyrimidine tract binding protein controls the transition from exon definition to an intron defined spliceosome. Nat Struct Mol Biol. 2008;15. 
",https://www.ncbi.nlm.nih.gov/gene?Db=gene&Cmd=DetailsSearch&Term=5725,https://www.uniprot.org/uniprot/P26599,https://www.genecards.org/cgi-bin/carddisp.pl?gene=PTBP1,https://string-db.org/network/9606.ENSP00000349428,19
PTB,PTBP2,polypyrimidine tract binding protein 2,ENSG00000117569,An RNA-binding protein that binds to intronic polypyrimidine tracts and mediates down-regulation of exon splicing and is involved in controlling the assembly of other splicing regulatory proteins. It can antagonize in a tissue-specific manner NOVA1's ability to activate exon selection.,E and A complex ,no,"Oberstrass FC, Auwetor SD, Erat M, Hargous Y, Henning A, Wenter P, et al. Structural biology - Structure of PTB bound to RNA: Specific binding and implications for splicing regulation. Science (80- ). 2005 Sep 23;309(5743):2054–7. 
Sharma S, Kohlstaedt LA, Damianov A, Rio DC, Black DL. Polypyrimidine tract binding protein controls the transition from exon definition to an intron defined spliceosome. Nat Struct Mol Biol. 2008;15. 
Xue Y, Zhou Y, Wu T, Zhu T, Ji X, Kwon YS, et al. Genome-wide Analysis of PTB-RNA Interactions Reveals a Strategy Used by the General Splicing Repressor to Modulate Exon Inclusion or Skipping. Mol Cell. 2009 Dec 24;36(6):996–1006. 
",https://www.ncbi.nlm.nih.gov/gene?Db=gene&Cmd=DetailsSearch&Term=58155,https://www.uniprot.org/uniprot/Q9UKA9,https://www.genecards.org/cgi-bin/carddisp.pl?gene=PTBP2,https://string-db.org/network/9606.ENSP00000359216,18
Quaking,QKI,"QKI, KH domain containing RNA binding",ENSG00000112531,"RNA binding protein acts by regulating pre-mRNA splicing. It binds to the RNA core sequence 5'-NACUAAY-N(1,20)-UAAY-3'. Regulates target mRNA stability. It plays a central role in myelination. It has been reported as a critical alternative splicing regulator in cardiomyocytes.",Not identified,no,"Chen X, Liu Y, Xu C, Ba L, Liu Z, Li X, et al. QKI is a critical pre-mRNA alternative splicing regulator of cardiac myofibrillogenesis and contractile function. Nat Commun. 2021 Dec 1;12(1):1–18. 
Hall MP, Nagel RJ, Fagg WS, Shiue L, Cline MS, Perriman RJ, et al. Quaking and PTB control overlapping splicing regulatory networks during muscle cell differentiation. RNA. 2013 May 1;19(5):627–38. 
De Bruin RG, Shiue L, Prins J, De Boer HC, Singh A, Fagg WS, et al. Quaking promotes monocyte differentiation into pro-atherogenic macrophages by controlling pre-mRNA splicing and gene expression. Nat Commun. 2016 Mar 31;7(1):1–20. 
",https://www.ncbi.nlm.nih.gov/gene?Db=gene&Cmd=DetailsSearch&Term=9444,https://www.uniprot.org/uniprot/Q96PU8,https://www.genecards.org/cgi-bin/carddisp.pl?gene=QKI,https://string-db.org/network/9606.ENSP00000355094,16
FOX-1,RBFOX1,"RNA binding protein, fox-1 homolog 1",ENSG00000078328,RNA binding protein that regulates alternative splicing events by binding to 5'-UGCAUGU-3' elements. Regulates alternate splicing of tissue-specific exons and exons during erythropoiesis. It has been described as a key factor in regulating alternative splicing events important to neurodevelopment.,Not identified,no,"Fogel BL, Wexler E, Wahnich A, Friedrich T, Vijayendran C, Gao F, et al. RBFOX1 regulates both splicing and transcriptional networks in human neuronal development. Hum Mol Genet. 2012 Oct 1;21(19):4171–86. 
Klinck R, Fourrier A, Thibault P, Toutant J, Durand M, Lapointe E, et al. RBFOX1 cooperates with MBNL1 to control splicing in muscle, including events altered in myotonic dystrophy type 1. PLoS One. 2014 Sep 1;9(9):e107324. 
Lovci MT, Ghanem D, Marr H, Arnold J, Gee S, Parra M, et al. Rbfox proteins regulate alternative mRNA splicing through evolutionarily conserved RNA bridges. Nat Struct Mol Biol. 2013 Dec;20(12):1434–42. 
",https://www.ncbi.nlm.nih.gov/gene?Db=gene&Cmd=DetailsSearch&Term=54715,https://www.uniprot.org/uniprot/Q9NWB1,https://www.genecards.org/cgi-bin/carddisp.pl?gene=RBFOX1,https://string-db.org/network/9606.ENSP00000309117,19
FOX-2,RBFOX2,"RNA binding protein, fox-1 homolog 2",ENSG00000100320,"RNA binding protein that regulates alternative splicing events by binding to 5'-UGCAUGU-3' elements. Regulates alternate splicing of tissue-specific exons and exons during erythropoiesis. It is involved in the splicing of ataxin-2 transcripts. Furthermore, it has been reported as a physiological activator of E16 splicing in differentiating erythroid cells in vivo.",Not identified,no,"Lovci MT, Ghanem D, Marr H, Arnold J, Gee S, Parra M, et al. Rbfox proteins regulate alternative mRNA splicing through evolutionarily conserved RNA bridges. Nat Struct Mol Biol. 2013 Dec;20(12):1434–42. 
Ponthier JL, Schluepen C, Chen W, Lersch RA, Gee SL, Hou VC, et al. Fox-2 splicing factor binds to a conserved intron motif to promote inclusion of protein 4.1R alternative exon 16. J Biol Chem. 2006 May 5;281(18):12468–74. 
Welzel F, Kaehler C, Isau M, Hallen L, Lehrach H, Krobitsch S. FOX-2 dependent splicing of ataxin-2 transcript is affected by ataxin-1 overexpression. PLoS One. 2012 May 30;7(5):e37985. 
",https://www.ncbi.nlm.nih.gov/gene?Db=gene&Cmd=DetailsSearch&Term=23543,https://www.uniprot.org/uniprot/O43251,https://www.genecards.org/cgi-bin/carddisp.pl?gene=RBFOX2,https://string-db.org/network/9606.ENSP00000413035,22
FOX-3,RBFOX3,"RNA binding protein, fox-1 homolog 3",ENSG00000167281,"Alternative pre-mRNA splicing regulator. It regulates alternative splicing of RBFOX2 to increase the production of mRNA species that are targeted for nonsense-mediated decay (NMD). The protein has an N-terminal proline-rich region, an RNA recognition motif (RRM) domain, and a C-terminal alanine-rich region.",Not identified,no,"Lovci MT, Ghanem D, Marr H, Arnold J, Gee S, Parra M, et al. Rbfox proteins regulate alternative mRNA splicing through evolutionarily conserved RNA bridges. Nat Struct Mol Biol. 2013 Dec;20(12):1434–42. 
Kim KK, Nam J, Mukouyama YS, Kawamoto S. Rbfox3-regulated alternative splicing of Numb promotes neuronal differentiation during development. J Cell Biol. 2013 Feb 18;200(4):443–58. 
Duan W, Zhang YP, Hou Z, Huang C, Zhu H, Zhang CQ, et al. Novel Insights into NeuN: from Neuronal Marker to Splicing Regulator. Vol. 53, Molecular Neurobiology. Humana Press Inc.; 2016. p. 1637–47. 
",https://www.ncbi.nlm.nih.gov/gene?Db=gene&Cmd=DetailsSearch&Term=146713,https://www.uniprot.org/uniprot/Q8BIF2,https://www.genecards.org/cgi-bin/carddisp.pl?gene=RBFOX3,https://string-db.org/network/9606.ENSP00000463653,18
